<!DOCTYPE database [
<!ELEMENT database (table*)>
<!ELEMENT table name CDATA #REQUIRED (row*)>
<!ELEMENT row (col*)>
<!ELEMENT col name CDATA #REQUIRED (#CDATA)>
]>
